Title,Description,Links,"Publication Date"
"Прибыль HSBC выросла почти вчетверо в первом квартале","Выручка британского банка HSBC выросла в первом квартале на 74%, составив $20,2 млрд. Чистая прибыль увеличилась почти в четыре раза, до $10,3 млрд.",https://www.kommersant.ru/doc/5966801,"Tue, 02 May 2023 15:48:38 +0300"
"NYT: разведка ФРГ призывала работающих близ посольства РФ чиновников задергивать шторы","Разведывательные службы Германии на протяжении нескольких лет призывали членов парламента, работающих вблизи здания российского посольства в Берлине, «отворачивать экраны компьютеров» от окон, не использовать беспроводные устройства (поскольку их легче прослушать), а также задергивать занавески во время заседаний. Об этом сообщает The New York Times (NYT) со ссылкой на источники из парламента.",https://www.kommersant.ru/doc/5966815,"Tue, 02 May 2023 15:48:01 +0300"
"Глава фракции «Грузинской мечты» назвал «неформальными санкциями»  блокировку $2 млрд Бидзины Иванишвили в Credit Suisse","Председатель парламентской фракции партии «Грузинская мечта» Мамука Мдинарадзе в беседе с журналистами сегодня, 2 мая, сказал, что блокировка $2 млрд в швейцарском банке Credit Suisse основателя партии и бывшего премьер-министра страны Бидзины Иванишвили — это «неформальные санкции». По словам господина Мдинарадзе, ограничения «были введены после начала войны на Украине», когда «всемирная партия войны» требовала от Бидзины Иванишвили «вернуться в политику и втянуть Грузию в войну» против России, передает издание Interpressnews.",https://www.kommersant.ru/doc/5966746,"Tue, 02 May 2023 15:45:40 +0300"
"Министр обороны Украины Резников намекнул на техногенные катастрофы в России","Министр обороны Украины Алексей Резников заявил, что «не удивится», если в России произойдет серьезная техногенная катастрофа, которая потребует немедленного внимания властей. По его мнению, Москва может попытаться «объяснить» окончание активных боевых действий на Украине необходимостью реагировать на катастрофу.",https://www.kommersant.ru/doc/5966816,"Tue, 02 May 2023 15:45:38 +0300"
"NYT: медиагруппа Vice может объявить о банкротстве","По данным The New York Times (NYT), ссылающейся на несколько неназванных источников, американо-канадская Vice Media Group, владеющая такими популярными ресурсами, как Vice и Motherboard, готовится в ближайшие несколько недель подать заявление о банкротстве. NYT сообщает, что в последнее время компания занята поиском покупателя на свои активы и, если таковой будет найден, Vice может избежать банкротства.",https://www.kommersant.ru/doc/5966796,"Tue, 02 May 2023 15:39:49 +0300"
"Австралия запретила рекреационное использование вейпов","Власти Австралии резко ужесточили законы, регулирующие продажу и использование электронных сигарет и вейпов в надежде справиться с ростом числа курильщиков среди подростков и молодежи. Эксперты назвали меры самой масштабной реформой сферы курения за последние десять с лишним лет.",https://www.kommersant.ru/doc/5966806,"Tue, 02 May 2023 15:38:56 +0300"
"В Кремле внимательно следят за ситуацией с госдолгом США","Пресс-секретарь президента России Дмитрий Песков заявил, что российские власти внимательно отслеживают ситуацию с государственным долгом в США. По его словам, в Кремле также внимательно следят и за другими проблемами, с которыми сталкивается мировая экономика.",https://www.kommersant.ru/doc/5966807,"Tue, 02 May 2023 15:31:39 +0300"
"Песков: ФРГ не может следить за тем, чтобы Украина не использовала ее оружие для ударов по РФ","Пресс-секретарь президента России Дмитрий Песков прокомментировал заявление канцлера Германии Олафа Шольца о том, что ФРГ будет следить за тем, чтобы ее оружие не использовалось Украиной для ударов по РФ. По словам господина Пескова, у Германии нет возможности за этим следить, а Украина уже использует поставленное из ФРГ оружие для ударов по территории России.",https://www.kommersant.ru/doc/5966803,"Tue, 02 May 2023 15:18:47 +0300"
"Samsung запретила сотрудникам пользоваться чат-ботами","Как сообщает Bloomberg, Samsung Electronics разослала своим сотрудникам письмо на прошлой неделе, в котором говорится о введении запрета на использование чат-ботов с искусственным интеллектом вроде ChatGPT, Bard или Bing. Поводом для введения запрета стало неосторожное пользование ChatGPT некоторыми инженерами компании, которые в апреле загрузили в нейросеть исходный код одного из продуктов Samsung, в результате чего тот оказался в открытом доступе.",https://www.kommersant.ru/doc/5966767,"Tue, 02 May 2023 15:14:15 +0300"
"Глава Минобороны Украины связал успех контрнаступления с будущей поддержкой союзников","Министр обороны Украины Алексей Резников заявил, что успех украинского контрнаступления будет иметь большое значение для союзников страны, которые продолжат поддерживать ее в военном конфликте. Такое мнение Алексей Резников выразил в интервью «Интерфакс-Украина».",https://www.kommersant.ru/doc/5966764,"Tue, 02 May 2023 15:13:19 +0300"
"Прибыль Logitech упала на 43% в 2022 году","Швейцарский производитель периферии для ПК Logitech представил отчетность за четвертый квартал и весь финансовый 2022 год, закончившийся 31 марта. Выручка компании за год снизилась на 17%, до $4,5 млрд, чистая прибыль — на 43%, до $365 млн.",https://www.kommersant.ru/doc/5966763,"Tue, 02 May 2023 15:09:43 +0300"
"Песков: спецслужбы делают все необходимое, чтобы не допустить диверсий на 9 Мая","Пресс-секретарь президента России Дмитрий Песков заявил, что спецслужбы делают все необходимое для обеспечения безопасности на мероприятиях, которые пройдут 9 мая в честь Дня Победы. По его словам, в Кремле учитывают, что «киевский режим стоит за целым рядом террористических актов и планирует их дальше».",https://www.kommersant.ru/doc/5966797,"Tue, 02 May 2023 15:08:00 +0300"
"Путин по видеосвязи запустил трамвайное движение в Мариуполе","Президент Владимир Путин принял по видеосвязи участие в церемонии открытия трамвайных путей в Мариуполе. Вместе с президентом был губернатор Санкт-Петербурга Александр Беглов.",https://www.kommersant.ru/doc/5966798,"Tue, 02 May 2023 15:04:32 +0300"
"IBM рассчитывает заменить порядка 7,8 тыс. сотрудников искусственным интеллектом","Генеральный директор IBM Арванд Кришна заявил в интервью агентству Bloomberg, что его компания намерена прекратить наем сотрудников на те позиции, которые в ближайшем будущем могут быть легко заменены искусственным интеллектом. По мнению господина Кришны, искусственный интеллект может легко справиться с рутинными задачами, которые сейчас выполняют некоторые офисные специалисты, не имеющие прямого отношения к продукции компании.",https://www.kommersant.ru/doc/5966750,"Tue, 02 May 2023 15:04:14 +0300"
"Кремль напомнил о невыполненных условиях для продления зерновой сделки","Контакты по зерновой сделке продолжаются, но не приносят результатов, утверждает пресс-секретарь президента России Дмитрий Песков. Он не стал подтверждать информацию Reuters о том, что завтра, 3 мая, пройдут переговоры по сделке с участием всех ее сторон.",https://www.kommersant.ru/doc/5966774,"Tue, 02 May 2023 14:59:55 +0300"
"Кремлю не известно о миссии Ватикана по урегулированию конфликта на Украине","Пресс-секретарь президента России Дмитрий Песков заявил, что Кремлю ничего не известно о мирной миссии Ватикана на Украине, о которой 30 апреля заявил папа римский Франциск. По словам понтифика, миссия Ватикана по урегулированию конфликта на Украине  не является публичной.",https://www.kommersant.ru/doc/5966781,"Tue, 02 May 2023 14:55:27 +0300"
"На Украине около 23 тыс. человек считаются пропавшими в результате боевых действий","В МВД Украины заработал единый реестр лиц, пропавших без вести «при особых обстоятельствах», сообщил замминистра внутренних дел Леонид Тимченко. По данным ведомства, около 23 тыс. человек считаются пропавшими без вести в результате боевых действий.",https://www.kommersant.ru/doc/5966762,"Tue, 02 May 2023 14:54:05 +0300"
"МИД России не подтвердил переговоры по зерновой сделке 3 мая","К российской стороне не поступало информации о какой-либо встрече по зерновой сделке, сообщила «Интерфаксу» пресс-служба Министерства иностранных дел России. Ранее источник Reuters сообщал, что переговоры по зерновой сделке с участием всех сторон соглашения планируются завтра, 3 мая.",https://www.kommersant.ru/doc/5966768,"Tue, 02 May 2023 14:50:56 +0300"
"Песков: данные Пентагона о потерях России на Украине взяты с потолка","США не располагают достоверными данными о потерях России в украинском конфликте, информация о 100 тыс. убитых и раненых «взята с потолка», заявил пресс-секретарь президента России Дмитрий Песков. Ранее такие данные привел координатор по стратегическим коммуникациям Совета национальной безопасности США Джон Кирби.",https://www.kommersant.ru/doc/5966778,"Tue, 02 May 2023 14:48:08 +0300"
"Чистая прибыль НСПК по РСБУ в 2022 году увеличилась в 2,58 раза","Чистая прибыль Национальной системы платежных карт (НСПК) по РСБУ в 2022 году составила 25,3 млрд руб., что в 2,58 раза больше, чем в предыдущем году, следует из отчетности компании. НСПК создана в 2014 году.",https://www.kommersant.ru/doc/5966760,"Tue, 02 May 2023 14:39:30 +0300"
"Баскетболист ЦСКА Швед получил черепно-мозговую травму в результате нападения","Защитник баскетбольного клуба ЦСКА Алексей Швед получил черепно-мозговую травму в результате нападения в Москве. По словам президента московского клуба Андрея Ватутина, в настоящее время Алексей Швед находится в больнице.",https://www.kommersant.ru/doc/5966741,"Tue, 02 May 2023 14:24:36 +0300"
"Минфин: нефть Urals в апреле подорожала до $58,63 за баррель","Минфин сообщил, что средняя цена на нефть марки Urals в январе—апреле составила $51,05 за баррель. Это в 1,65 раза меньше по сравнению с аналогичным периодом 2022 года ($84,68 за баррель).",https://www.kommersant.ru/doc/5966751,"Tue, 02 May 2023 14:21:49 +0300"
"Россия остается крупнейшим поставщиком нефти в Индию","В марте индийский импорт российской нефти впервые превысил суммарный импорт нефти из Саудовской Аравии и Ирака. Об этом свидетельствуют данные Vortexa Ltd, компании, отслеживающей в реальном времени поставки энергоносителей по всему миру.",https://www.kommersant.ru/doc/5966745,"Tue, 02 May 2023 14:15:47 +0300"
"Tinder завершит уход из России к 30 июня","Технологическая компания Match Group, владеющая и управляющая крупнейшим портфелем популярных онлайн-сервисов знакомств, включая Tinder, Match.com, Meetic, Ok Cupid, Hinge, Plenty Of Fish, Our Time, завершит уход из России к 30 июня, следует из ежегодного отчета компании. «Мы стараемся защищать права человека.",https://www.kommersant.ru/doc/5966743,"Tue, 02 May 2023 14:07:14 +0300"
"Путин наградил Гергиева орденом «За заслуги перед Отечеством» II степени","Президент Владимир Путин подписал указ о награждении орденом «За заслуги перед Отечеством» II степени директора Мариинского театра Валерия Гергиева. Ему сегодня, 2 мая, исполнилось 70 лет.",https://www.kommersant.ru/doc/5966739,"Tue, 02 May 2023 14:07:00 +0300"
"Прибыль ЛУКОЙЛа в первом квартале снизилась на 21,8%","В первом квартале 2023 года чистая прибыль ЛУКОЙЛа по российским стандартам бухгалтерского учета (РСБУ) составила 104,287 млрд руб. Это на 21,8% ниже по сравнению с аналогичным периодом прошлого года (133,381 млрд).",https://www.kommersant.ru/doc/5966733,"Tue, 02 May 2023 13:53:55 +0300"
"Глава КГБ Белоруссии заявил о готовящихся в стране акциях по дестабилизации обстановки","Председатель Комитета госбезопасности Белоруссии Иван Тертель заявил, что в стране планируется ряд акций по дестабилизации ситуации внутри республики. По его словам, спонсорами этих акций являются иностранные физлица, спецслужбы и другие организации.",https://www.kommersant.ru/doc/5966731,"Tue, 02 May 2023 13:53:03 +0300"
"С Валерия Израйлита сняли обвинения в мошенничестве и отмывании","Смольнинский районный суд Санкт-Петербурга прекратил по ходатайству Валерия Израйлита производство по двум уголовным делам о мошенничестве в особо крупном размере и одному — о легализации денежных средств (ч. 4 ст. 159 и ч. 4 ст. 174.1 УК РФ). Обвинения были сняты в связи с истечением сроков давности.",https://www.kommersant.ru/doc/5966707,"Tue, 02 May 2023 13:49:23 +0300"
"Федерация дзюдо отказала восьми россиянам в допуске к чемпионату мира после проверки их биографии","Исполнительный совет Международной федерации дзюдо (IJF) отказал восьми представителям сборной России в участии в чемпионате мира. Решение в их отношении было принято после проверки их биографических данных для выявления информации, предполагающей поддержку военной операции на Украине.",https://www.kommersant.ru/doc/5966727,"Tue, 02 May 2023 13:49:19 +0300"
"В Конгрессе США призвали проверить китайского ритейлера Shein на использование рабского труда","Группа членов Конгресса США от обеих партий призвала Комиссию по ценным бумагам и биржам (SEC) приостановить процедуру подготовки к первичному размещению акций (IPO) китайского ритейлера Shein, сообщает Reuters. Конгрессмены считают необходимым прежде удостовериться, что Shein, которая торгует модной одеждой по всему миру, не использует подневольный труд уйгуров.",https://www.kommersant.ru/doc/5966649,"Tue, 02 May 2023 13:34:52 +0300"
"Путин выразил соболезнования семье модельера Вячеслава Зайцева","Президент Владимир Путин направил соболезнования родным Вячеслава Зайцева, который умер 30 апреля. Господин Путин назвал модельера «талантливым, душевно щедрым, безраздельно увлеченным своим призванием» человеком.",https://www.kommersant.ru/doc/5966721,"Tue, 02 May 2023 13:33:25 +0300"
"Главы силовых ведомств Украины попросили отложить возврат выплат для военных в тылу","Главы украинских силовых ведомств попросили Верховную раду отложить принятие закона, возвращающего доплату  в размере 30 тыс. гривен ($814) военнослужащим, сотрудникам полиции и государственной службы по ЧС, которые проходят службу в тылу. Об этом в Telegram сообщил глава фракции «Слуга народа» в Верховной раде Давид Арахамия.",https://www.kommersant.ru/doc/5966708,"Tue, 02 May 2023 13:26:50 +0300"
"Суд в Москве 24 мая рассмотрит вопрос о выдаче Сапеги в Россию","Пресненский суд Москвы 24 мая рассмотрит представление ФСИН о передаче осужденной в Белоруссии Софьи Сапеги в Россию. Заседание назначено на 12:00, следует из карточки.",https://www.kommersant.ru/doc/5966703,"Tue, 02 May 2023 13:20:51 +0300"
"ФНС приостановила операции по счетам двух компаний блогера Оксаны Самойловой","По решению Федеральной налоговой службы (ФНС) операции по счетам двух компаний, гендиректором которых является блогер Оксана Самойлова, приостановлены. Речь идет о предприятиях ООО «Фэмэли Фест» и ООО «Айэмспэшел».",https://www.kommersant.ru/doc/5966709,"Tue, 02 May 2023 13:20:45 +0300"
"В Белоруссии только партия «Белая Русь» прошла предписанную законом перерегистрацию","Ни одна из белорусских партий пока не прошла перерегистрацию, кроме «Белой Руси». Об этом сообщил министр юстиции Белоруссии Сергей Хоменко.",https://www.kommersant.ru/doc/5966689,"Tue, 02 May 2023 13:09:15 +0300"
"Умер модельер Валентин Юдашкин","Умер модельер Валентин Юдашкин, сообщила его супруга «Первому каналу». Господину Юдашкину было 59 лет.",https://www.kommersant.ru/doc/5966702,"Tue, 02 May 2023 13:02:22 +0300"
"Шойгу: армия получает достаточно боеприпасов","Министр обороны Сергей Шойгу провел селекторное совещание. Он заявил, что в России начато серийное производство новейших типов вооружения.",https://www.kommersant.ru/doc/5966694,"Tue, 02 May 2023 12:57:10 +0300"
