Title,Description,Links,"Publication Date"
"Власти Крыма сообщили о сбитом беспилотнике","Глава Крыма Сергей Аксенов сообщил, что на западе республики сбит беспилотник. Сбили его силы противовоздушной обороны (ПВО).",https://www.kommersant.ru/doc/5966370,"Mon, 01 May 2023 18:21:19 +0300"
"Рогов заявил о завершении переброски на Запорожье трех бригад ВСУ","Председатель движения «Мы вместе с Россией» Владимир Рогов заявил о завершении переброски из центральной Украины в подконтрольную Киеву часть Запорожской области украинских военных. Об этом он заявил «РИА Новости».",https://www.kommersant.ru/doc/5966364,"Mon, 01 May 2023 18:04:46 +0300"
"ФСБ: бомба на опоре ЛЭП в Ленинградской области имела электронное управление","Обезвреженное взрывное устройство на опоре линии электропередачи (ЛЭП) в Гатчинском районе Ленинградской области имело дистанционное управление, сообщили «Российской газете» в пресс-службе регионального главка ФСБ. Бомбу обнаружили и обезвредили после подрыва соседней опоры ЛЭП в ночь на 1 мая.",https://www.kommersant.ru/doc/5966365,"Mon, 01 May 2023 17:57:45 +0300"
"ЛДПР: сервер Minecraft с памятником Жириновскому не выдержал потока желающих","В ЛДПР заявили, что сервер компьютерной игры Minecraft, где партия сконструировала виртуальный памятник покойному лидеру Владимиру Жириновскому и проводила «цифровой митинг» на 1 Мая, не выдержал числа желающих. По словам представителей ЛДПР, к событию подключились 12 тыс. пользователей.",https://www.kommersant.ru/doc/5966358,"Mon, 01 May 2023 17:35:51 +0300"
"Сошедший в Брянской области с рельс из-за подрыва путей железнодорожный состав оказался белорусским","Сошедший в Брянской области с рельсов в результате взрыва грузовой поезд принадлежит Белорусской железной дороге, сообщает Минтранс Белоруссии. С рельсов сошли 8 из 78 вагонов, локомотивная бригада не пострадала.",https://www.kommersant.ru/doc/5966360,"Mon, 01 May 2023 17:35:12 +0300"
"ЦБ Грузии перестал учитывать доходы переехавших россиян в качестве туристических","Несмотря на то что абсолютное большинство из примерно 120 тыс. граждан РФ, переехавших в Грузию на постоянное место жительство с марта 2022 года, формально обладают статусом туристов, доходы от их проживания в стране больше не будут учитываться в сумме общих доходов от туризма. Такое распоряжение издал Национальный банк Грузии, ссылаясь на необходимость уточнения статистики, а также соблюдения норм и предписаний Международного валютного фонда.",https://www.kommersant.ru/doc/5966332,"Mon, 01 May 2023 17:29:15 +0300"
"Япония развернула Patriot PAC-3 из-за планов КНДР запустить спутник","Министерство обороны Японии завершило переброску основного оборудования для развертывания зенитно-ракетных комплексов (ЗРК) Patriot (PAC-3) на трех островах в префектуре Окинава. ЗРК устанавливаются в ответ на планы КНДР запустить военный разведывательный спутник, сообщает японское агентство Kyodo.",https://www.kommersant.ru/doc/5966353,"Mon, 01 May 2023 17:11:41 +0300"
"Каладзе объяснил неполучение статуса в кандидаты ЕС отказом Грузии от присоединения к санкциям против РФ","Генеральный секретарь партии «Грузинская мечта», мэр Тбилиси Каха Каладзе заявил, что Грузии отказали в статусе кандидата в члены ЕС из-за неприсоединения к европейским санкциям против России. «Отказ в предоставлении Грузии статуса кандидата в члены ЕС был их политическим решением из-за неприсоединения Грузии к санкциям ЕС против России, а также из-за неоткрытия против нее второго фронта»,— заявил господин Каладзе.",https://www.kommersant.ru/doc/5966335,"Mon, 01 May 2023 17:10:04 +0300"
"Bloomberg объяснило запрет импорта украинского зерна в Польшу опасениями властей утратить поддержку избирателей","Введенный Польшей запрет на импорт украинского зерна в апреле частично связан с усилением поддержки обществом политики антиевропейского альянса «Конфедерация свободы и независимости», о чем свидетельствуют опросы, сообщает агентство Bloomberg. Лидер правящей в Польши партии «Право и справедливость» (ПиС) Ярослав Качиньский заявлял, что не в интересах Украины, если к власти в стране придут люди, которые изменят существующую политику.",https://www.kommersant.ru/doc/5966340,"Mon, 01 May 2023 16:51:23 +0300"
"На главного прокурора Болгарии Ивана Гешева совершено покушение","В Болгарии на участке трассы София—Самоков прогремел взрыв, сообщает телеканал БНТ со ссылкой на республиканское МВД. Бомба сработала в момент проезда кортежа главного прокурора страны Ивана Гешева.",https://www.kommersant.ru/doc/5966352,"Mon, 01 May 2023 16:46:53 +0300"
"В Париже на акции против повышения пенсионного возраста произошли стычки демонстрантов с полицией","Первомайская демонстрация стартовала в Париже в 14:00 по местному времени с площади Республики. Профсоюзы обещали «мощную» акцию протеста против окончательно принятого 15 апреля закона, поднявшего возраст выхода на пенсию до 64 лет.",https://www.kommersant.ru/doc/5966347,"Mon, 01 May 2023 16:29:50 +0300"
"Грузия отказала девяти гражданам РФ в предоставлении политического убежища","За первые три месяца текущего года 24 гражданина РФ обратились к грузинским властям с просьбой о предоставлении политического убежища либо так называемого гуманитарного статуса, гарантирующих, что их не отправят обратно в Россию. Об этом сообщает МВД Грузии.",https://www.kommersant.ru/doc/5966326,"Mon, 01 May 2023 16:16:52 +0300"
"Джек Ма стал преподавателем в Токио","Токийский колледж, подразделение Института передовых исследований Токийского университета, сообщил о том, что основатель Alibaba Джек Ма принял приглашение колледжа стать его внештатным профессором. Господин Ма будет проводить семинары по предпринимательской деятельности и примет участие в исследовательских проектах, связанных с ресурсосберегающей сельскохозяйственной деятельностью и производством продуктов питания.",https://www.kommersant.ru/doc/5966327,"Mon, 01 May 2023 16:12:23 +0300"
"Astellas Pharma приобретает Iveric Bio за $5,9 млрд","Японская фармацевтическая компания Astellas договорилась с американской Iveric Bio о покупке всех ее акций по цене $40 за каждую, что на 64% выше их стоимости на момент закрытия торгов 31 марта — последнего дня перед тем, как начались переговоры. Общая сумма сделки составит порядка $5,9 млрд.",https://www.kommersant.ru/doc/5966328,"Mon, 01 May 2023 15:59:25 +0300"
"Клишас раскритиковал законопроект об обязательном распределении выпускников вузов","Председатель комитета Совета федерации по конституционному законодательству и государственному строительству Андрей Клишас раскритиковал законопроект об обязательном распределении выпускников российских университетов. Закрыть кадровые потребности целесообразнее при помощи механизма целевого набора, считает сенатор.",https://www.kommersant.ru/doc/5966334,"Mon, 01 May 2023 15:56:03 +0300"
"В Грузии задержан мужчина за попытку продать уран на $2 млн","Сотрудники Службы госбезопасности Грузии задержали мужчину, который, как утверждается, планировал продать радиоактивное вещество за $2 млн долларов. По данным телеканала Rustavi, в заключении радиологической экспертизы указано, что в представленном для исследования материале обнаружен уран.",https://www.kommersant.ru/doc/5966321,"Mon, 01 May 2023 15:55:03 +0300"
"Богомаз: в результате подрыва железнодорожных путей с рельсов сошли два локомотива","Губернатор Брянской области Александр Богомаз посетил место подрыва железнодорожных путей в Унечском районе. Он заявил, что в результате ЧП с рельсов сошло два локомотива грузового состава, а не один, как сообщалось изначально.",https://www.kommersant.ru/doc/5966329,"Mon, 01 May 2023 15:22:52 +0300"
"First Republic Bank закрыт и продан JPMorgan Chase","Федеральная корпорация страхования вкладов (FDIC) объявила, что проблемный First Republic Bank был закрыт сегодня Департаментом финансовой защиты и инноваций Калифорнии и перешел под внешнее управление FDIC. Регулятор, в свою очередь, принял решение о продаже First Republic другому американскому банку — JPMorgan Chase.",https://www.kommersant.ru/doc/5966315,"Mon, 01 May 2023 14:45:10 +0300"
"Из-за пожара в Борзе эвакуированы девять воспитанников Центра помощи детям","Воспитанников Борзинского центра помощи детям в Забайкальском крае эвакуировали из учреждения из-за пожара в городе Борзя. Всего было эвакуировано девять детей, сообщила вице-премьер краевого правительства Инна Щеглова.",https://www.kommersant.ru/doc/5966313,"Mon, 01 May 2023 14:44:23 +0300"
"Футбольный клуб «Факел» возглавил Вадим Евсеев","Главным тренером воронежского футбольного клуба «Факел», выступающего в Российской премьер-лиге (РПЛ), назначен Вадим Евсеев, сообщила пресс-служба команды. Срок и условия его контракта не приводятся.",https://www.kommersant.ru/doc/5966314,"Mon, 01 May 2023 14:35:17 +0300"
"Главы МИД Армении и Азербайджана проведут в США переговоры с Блинкеном","Министры иностранных дел Азербайджана и Армении Джейхун Байрамов и Арарат Мирзоян сегодня, 1 мая, посетят США. Там они проведут переговоры с участием госсекретаря Энтони Блинкена, сообщается на сайте Госдепа.",https://www.kommersant.ru/doc/5966311,"Mon, 01 May 2023 14:24:01 +0300"
"Состояние российских миллиардеров с начала 2023 года года выросло на $16,35 млрд","С начала 2023 года совокупное состояние богатейших предпринимателей из России выросло на $16,35 млрд, подсчитало «РИА Новости» на основании данных рейтинга Bloomberg Billionaires Index. Сильнее всего выросло состояние совладельца НК ЛУКОЙЛ Вагита Алекперова — более чем на $3,7 млрд, до $19,1 млрд.",https://www.kommersant.ru/doc/5966309,"Mon, 01 May 2023 14:18:45 +0300"
"СМИ: на месте подрыва ЛЭП в Ленобласти нашли еще три взрывных устройства","На месте подрыва линии электропередачи (ЛЭП) в Гатчинском районе Ленинградской области обнаружили еще три взрывных устройства, сообщает Telegram-канал 78 со ссылкой на источник. Он уточнил, что там продолжают работать оперативные службы ФСБ и МВД.",https://www.kommersant.ru/doc/5966310,"Mon, 01 May 2023 14:16:28 +0300"
"В Брянской области потушен пожар на месте схода вагонов после подрыва железнодорожных путей","Пожар, начавшийся в результате подрыва железнодорожных путей в Брянской области, потушен, сообщили в РЖД. Для ликвидации последствий разлива нефтепродуктов, который образовался из-за сошедших с путей грузовых вагонов, на место отправили экологическую лабораторию.",https://www.kommersant.ru/doc/5966306,"Mon, 01 May 2023 14:11:25 +0300"
"Бой Фабио Мальдонадо и Ивана Емельяненко отменен","Планировавшийся на 26 мая бой по правилам смешанных единоборств (ММА) между бразильцем Фабио Мальдонадо и россиянином Иваном Емельяненко отменен. Об этом сам Мальдонадо сообщил ТАСС, причины отмены неизвестны.",https://www.kommersant.ru/doc/5966304,"Mon, 01 May 2023 13:51:40 +0300"
"Министр обороны Украины Резников призвал власти Японии поставить вооружение для борьбы с беспилотниками","Министр обороны Украины Алексей Резников обратился к японским властям с просьбой оказать поддержку Киеву и предоставить средства радиоэлектронной борьбы. Об этом он заявил в интервью агентству «Киодо».",https://www.kommersant.ru/doc/5966301,"Mon, 01 May 2023 13:49:51 +0300"
"Канал для водоснабжения Донбасса запустили в тестовом режиме","В канал Дон–Донбасс, который строят для снабжения Донецкой агломерации, 30 апреля был совершен первый пуск воды. Об этом сообщается в Telegram-канале Военно-строительной компании (ВСК) Минобороны РФ.",https://www.kommersant.ru/doc/5966299,"Mon, 01 May 2023 13:40:03 +0300"
"РЕН ТВ: похожий на гранату Ф-1 предмет нашли в Южном Бутово","В районе Южное Бутово в Москве у площадки для выгула собак обнаружили предмет, похожий на гранату Ф-1. Об этом сообщает РЕН ТВ.",https://www.kommersant.ru/doc/5966293,"Mon, 01 May 2023 13:21:47 +0300"
"Путин присвоил звания Героев Труда пяти россиянам","Президент России Владимир Путин подписал указ о присуждении звания «Герой Труда РФ» пятерым гражданам «за особые трудовые заслуги перед государством и народом». Соответствующий документ опубликован на сайте Кремля.",https://www.kommersant.ru/doc/5966294,"Mon, 01 May 2023 13:04:09 +0300"
"«Известия»: на юго-западе Брянской области введен план «Перехват» после подрыва железнодорожных путей","Железнодорожные пути в Брянской области подорвали прямо перед самим поездом, сообщают «Известия» со ссылкой на источник. По данным издания, на юго-западе региона ввели план «Перехват».",https://www.kommersant.ru/doc/5966289,"Mon, 01 May 2023 12:43:40 +0300"
"На Украину поступили американские авиационные ракеты Zuni","Командующий воздушными силами Вооруженных сил Украины (ВСУ) Николай Олещук опубликовал в Telegram фотографию самолета Су-25 с ракетами. Как уточняет агентство УНИАН,  это американские неуправляемые авиационные ракеты класса «воздух–земля» Zuni.",https://www.kommersant.ru/doc/5966290,"Mon, 01 May 2023 12:41:42 +0300"
"Бета-версия Steam позволяет показывать заметки поверх игр","Сервис цифровой дистрибуции игр Steam выпустил новую бета-версию, в которой появилась функция блокнота поверх игры. Теперь пользователи могут создать ряд заметок (например, о том, что им надо сделать в игре) и видеть их во время игрового процесса.",https://www.kommersant.ru/doc/5966262,"Mon, 01 May 2023 12:36:19 +0300"
"Власти Днепропетровской области сообщили о 34 раненых при взрывах в Павлограде","В результате взрывов в городе Павлоград Днепропетровской области ранения получили 34 человека, в том числе пятеро детей, сообщил в Telegram глава местной администрации Сергей Лысак. Взрывы произошли сегодня, 1 мая, ночью.",https://www.kommersant.ru/doc/5966287,"Mon, 01 May 2023 12:34:39 +0300"
"Ян Непомнящий сохранил второе место в рейтинге Международной шахматной федерации","Российский гроссмейстер Ян Непомнящий сохранил свою позицию в рейтинге Международной шахматной федерации (FIDE). На его счету 2 794 очка, он находится на втором месте.",https://www.kommersant.ru/doc/5966283,"Mon, 01 May 2023 12:23:00 +0300"
"После подрыва опоры ЛЭП в Ленобласти возбудили дело о диверсии","По факту подрыва опоры линии электропередачи (ЛЭП) в Ленинградской области ФСБ возбудила дело по ст. 281 (диверсия) и 222.1 (незаконный оборот взрывных устройств) УК РФ.",https://www.kommersant.ru/doc/5966285,"Mon, 01 May 2023 12:17:49 +0300"
"«Газпром» остановил подачу газа в Армению до 4 мая из-за ремонта","Подача газа из России в Армению по магистральному газопроводу «Северный Кавказ—Закавказье» временно приостановлена из-за ремонтных работ. Возобновить подачу топлива планируют 4 мая.",https://www.kommersant.ru/doc/5966278,"Mon, 01 May 2023 12:04:28 +0300"
"«Ренхап»: замглавы МИД Южной Кореи посетит Москву","Первый заместитель министра иностранных дел Чан Хо Чжин планирует посетить Россию, сообщает «Ренхап» со ссылкой на источники. Предполагается, что темой встречи будет недавнее заявление южнокорейского президента Юн Сок Ёля о возможных поставках оружия Украине.",https://www.kommersant.ru/doc/5966282,"Mon, 01 May 2023 12:04:14 +0300"
"В Брянской области в результате подрыва путей сошел с рельсов поезд с нефтепродуктами","Губернатор Брянской области Александр Богомаз сообщил в Telegram, что в Унечском районе на 136-м километре железнодорожных путей Брянск—Унеча сработало неустановленное взрывное устройство. В результате подрыва сошел с рельсов локомотив грузового состава, начался пожар.",https://www.kommersant.ru/doc/5966276,"Mon, 01 May 2023 11:35:03 +0300"
