Title,Description,Links,"Publication Date"
"Голодный студент съел знаменитый банан из произведения искусства","
    Экипажи самолетов Ту-142М3 морской авиации Тихоокеанского флота в ходе учебно-тренировочных полетов над Тихим океаном обнаружили подлодку условного противника и передали ее координаты надводному кораблю флота, сообщили в пресс-службе ТОФ. Также летчики отработали применение средств обнаружения.
  ",https://lenta.ru/news/2023/05/03/tu142/,"Wed, 03 May 2023 17:27:00 +0300"
"В России призвали к реакции на провокации НАТО","
    В Сеуле студент факультета истории искусств съел банан, который был частью арт-инсталяции Маурицио Каттелана. Парень объяснил свой поступок голодом из-за пропущенного завтрака. Арт-инсталляция под названием «Комик» была частью персональной выставки «МЫ». Она состояла из спелого банана, приклеенного к стене изолентой.<br />
  ",https://lenta.ru/news/2023/05/03/banana_art/,"Wed, 03 May 2023 17:27:00 +0300"
"Пассажирский самолет из Стамбула приготовился к аварийной посадке в Сочи","
    Действия НАТО ведут к росту напряженности, и российской стороне необходимо адекватно на них реагировать. Об этом заявил глава делегации РФ на переговорах в Вене по вопросам военной безопасности и контроля над вооружениями Константин Гаврилов во время выступления на пленарном заседании форума ОБСЕ.
  ",https://lenta.ru/news/2023/05/03/nato_gavrilov/,"Wed, 03 May 2023 17:26:00 +0300"
"Более 200 сообщений о БПЛА поступило за сутки в экстренные службы Москвы","
    Пассажирский самолет, вылетевший из Стамбула, готовится к аварийной посадке в аэропорту Сочи. Лайнер направлялся в столичный аэропорт Домодедово, однако из-за технических проблем не смог продолжить полет. В экстренных службах утончили, на борту воздушного судна находятся 44 пассажира. 
  ",https://lenta.ru/news/2023/05/03/sochi_avia/,"Wed, 03 May 2023 17:23:00 +0300"
"Финляндия отказалась передавать Украине истребители Hornet","
    Более 200 сообщений о беспилотных летательных аппаратах (БПЛА) поступило за прошедшие сутки в экстренные службы Москвы.  По сведениям издания Baza, служба 112 за 2 мая зарегистрировала 203 обращения о летающих дронах в столице. Количество подобных сообщений растет ежедневно.
  ",https://lenta.ru/news/2023/05/03/bplaas/,"Wed, 03 May 2023 17:20:00 +0300"
"Депутат Вассерман предложил бороться с украинскими дронами сеткой-рабицей","
    Президент Финляндии Саули Ниинисте заявил, что Хельсинки не готов передать свои истребители McDonnell Douglas F/A-18 Hornet Украине. По словам политика, у страны есть только старые самолеты, которые вскоре хотят заменить. «Нам сейчас нужна сильная безопасность», — подчеркнул он. 
  ",https://lenta.ru/news/2023/05/03/3545/,"Wed, 03 May 2023 17:19:00 +0300"
"В Петербурге вслед за Москвой ввели запрет на запуск беспилотников","
    Пока еще не разработаны способные противостоять мелким летающим объектам системы противовоздушной обороны (ПВО), бороться с украинскими дронами можно с помощью сетки-рабицы. Такое предложение озвучил политик, публицист, депутат Государственной думы Анатолий Вассерман, его цитирует RostovGazeta.
  ",https://lenta.ru/news/2023/05/03/setka/,"Wed, 03 May 2023 17:17:00 +0300"
"В США заявили о проведении оценки атаки на Кремль","
    В Санкт-Петербурге вслед за Москвой ввели запрет на запуск беспилотных летательных аппаратов (БПЛА). Он будет действовать до 15 мая. В целях безопасности полеты коптеров запрещены в радиусе 150 километров вокруг Северной столицы. В Законодательном собрании Петербурга подтвердили информацию.
  ",https://lenta.ru/news/2023/05/03/zapretsspiters/,"Wed, 03 May 2023 17:17:00 +0300"
"Модель описала внешность после стрижки челки в салоне фразой «выгляжу как гриб»","
    США проводят оценку атаки двух украинских беспилотных летательных аппаратов (БПЛА) на Кремль, которая была совершена в ночь на 3 мая. Об этом сообщает Reuters со ссылкой на неназванного американского чиновника. «Мы все еще пытаемся оценить эту информацию», — заявил источник.
  ",https://lenta.ru/news/2023/05/03/usa_kremlin/,"Wed, 03 May 2023 17:17:00 +0300"
"В ряде регионов Эстонии запретили использовать российскую символику на 9 Мая","
    Модель Виктория Оливер из Южной Африки описала внешность после стрижки челки в салоне фразой «выгляжу как гриб». Так, вначале на размещенных кадрах она продемонстрировала, как выглядела до похода в парикмахерскую. У юзерши были прямые гладкие волосы по плечи. Затем она показала результат работы мастера.
  ",https://lenta.ru/news/2023/05/03/fringe-fail/,"Wed, 03 May 2023 17:13:48 +0300"
"Саудовской Аравии предсказали экономические проблемы из-за дешевой нефти","
    Полиция Эстонии запретила в ряде регионов проведение общественных мероприятий с использованием российской и советской символики по случаю празднования Дня Победы. Ограничение распространяется на регионы с большой численностью русского населения, а именно уездов Харьюмаа, Ляэне-Вирумаа и Ида-Вирумаа.
  ",https://lenta.ru/news/2023/05/03/policiaestonii/,"Wed, 03 May 2023 17:05:13 +0300"
"В Киеве объявили воздушную тревогу","
    Международный валютный фонд (МВФ) предсказал Саудовской Аравии экономические проблемы, если цены на нефть останутся на отметке ниже 80 долларов за баррель. По оценке фонда, страна рискует вернуться к дефициту бюджета в 2023 году после первого за почти десятилетие профицита.
  ",https://lenta.ru/news/2023/05/03/barrel/,"Wed, 03 May 2023 17:04:00 +0300"
"Россиянин во время ссоры сбросил знакомого с седьмого этажа","
    В Киеве и девяти областях Украины объявили воздушную тревогу. Сообщается, что сигнал тревоги звучит в столице, а также в Киевской, Черниговской, Черкасской, Полтавской, Сумской, Кировоградской, Днепропетровской и Харьковской областях, а также на подконтрольной Киеву территории Запорожской области.
  ",https://lenta.ru/news/2023/05/03/trevoga_trevoga/,"Wed, 03 May 2023 17:02:29 +0300"
"В российском регионе туристка не дождалась спасателей и умерла","
    В Тюмени 42-летнего уроженца Новосибирска обвинили в убийстве знакомого. По версии следствия, 1 мая мужчина во время с застолья вышел с 41-летним потерпевшим на балкон, где между ними возник конфликт. Тогда фигурант схватил оппонента за ноги и сбросил с высоты седьмого этажа.
  ",https://lenta.ru/news/2023/05/03/sedmoyetaz/,"Wed, 03 May 2023 17:02:00 +0300"
"Годовалая девочка утонула в декоративном пруду в российском регионе","
    Отдыхавшая в Туве россиянка не дождалась спасателей и умерла. Несчастный случай произошел с жительницей Красноярска во время отдыха в Бай-Тайгинском районе. По предварительным данным, у нее возникли проблемы с сердцем. Спасателям не удалось пробраться к туристке из-за погодных условий.
  ",https://lenta.ru/news/2023/05/03/tuva/,"Wed, 03 May 2023 17:00:00 +0300"
"Субсидии закрытым российским аэропортам резко сократили","
    В селе Прасковея Ставропольского края годовалая девочка утонула в декоративном пруду, который находился в саду у бабушки. По предварительным данным, ребенка оставили ненадолго без присмотра. Девочка стала изучать придомовую территорию. Ее внимание привлек декоративный пруд, разбитый около клумбы.
  ",https://lenta.ru/news/2023/05/03/girlss/,"Wed, 03 May 2023 16:59:18 +0300"
"Диетолог подсказала способ выбрать эффективную диету для похудения","
    Субсидии аэропортам юга России, закрытым из-за СВО, снизились в три раза в 2023 году. Один из источников газеты «Ведомости» сообщил, что за первый квартал 2023 года правительством согласовано выделение 2,5 миллиарда рублей, при этом о возможной дальнейшей поддержке ему не известно. 
  ",https://lenta.ru/news/2023/05/03/airports/,"Wed, 03 May 2023 16:59:08 +0300"
"Предсказано опустынивание средиземноморских лесов","
    По мнению диетолога Ванессы Риссетто, первое, что должен сделать человек, выбирая диету, — это спросить себя насколько она безопасна для здоровья. Например, исключение из рациона жиров, белков и углеводов является верным признаком неадекватной диеты, которая вредит организму.
  ",https://lenta.ru/news/2023/05/03/diet/,"Wed, 03 May 2023 16:55:03 +0300"
"Тренер раскрыла секрет упругих ягодиц «как у Кардашьян»","
    Геологи Гейдельбергского университета в Германии показали, что из-за изменения климата нарастает угроза опустынивания средиземноморских лесов в будущем. Уменьшение осадков на 40-45 процентов в результате увеличения содержания CO2 в прошлом провоцировало переход от лесных экосистем к степным.
  ",https://lenta.ru/news/2023/05/03/climate/,"Wed, 03 May 2023 16:54:00 +0300"
"Володин назвал теракт в отношении президента нападением на Россию","
    Тренер Рэйчел Сасердоти раскрыла секрет упругих ягодиц «как у Ким Кардашьян». Специалист посоветовала делать четыре упражнения с отягощениями: ягодичные мостики, приседания, становую тягу и болгарские выпады. Каждое из них рекомендуется выполнять в четыре подхода по 12 раз с 30-секундным перерывом.
  ",https://lenta.ru/news/2023/05/03/bebetter/,"Wed, 03 May 2023 16:53:00 +0300"
"Госдума потребует применения «способного уничтожить киевский режим» оружия","
    Теракт в отношении президента России является нападением на страну. Об этом в среду, 3 мая, заявил спикер Госдумы Вячеслав Володин в своем Telegram-канале. Политик призвал признать киевский режим террористической организацией и заявил, что президент Украины Владимир Зеленский встал в ряд с другими террористами. 
  ",https://lenta.ru/news/2023/05/03/napadenie/,"Wed, 03 May 2023 16:53:00 +0300"
"Праздник Охотского пельменя прошел в российском регионе","
    Госдума потребует применения оружия, «способного уничтожить киевский режим». Такое заявление сделал председатель нижней палаты российского парламента Вячеслав Володин, добавив, что западные политики, которые поставляют Украине оружие, должны осознать, что стали «прямыми соучастниками террористической деятельности».
  ",https://lenta.ru/news/2023/05/03/oruzhie/,"Wed, 03 May 2023 16:50:20 +0300"
"Стали известны подробности возвращения Пугачевой в Москву","
    В райцентре северного района Хабаровского края прошел праздник Охотского пельменя. Отмечается, что это традиционный для Охотска конкурс среди трудовых коллективов. Четыре команды приняли участие в соревновании по умению приготовления и скорости лепки пельменей с рыбным фаршем.
  ",https://lenta.ru/news/2023/05/03/pelmen/,"Wed, 03 May 2023 16:50:08 +0300"
"Володин назвал власти Украины террористами после удара по Кремлю","
    Стали известны подробности возвращения эстрадной певицы Аллы Пугачевой в Москву. Сообщается, что артистка прилетела в столицу России на несколько дней на рейсовом самолете и сразу отправилась в свой замок в деревне Грязь. Причиной возвращения исполнительницы стали смерти ее друзей, модельеров Юдашкина и Зайцева. 
  ",https://lenta.ru/news/2023/05/03/pugacheva_details/,"Wed, 03 May 2023 16:50:00 +0300"
"Россиянам перечислили способы сохранить качество волос","
    Украинские власти являются террористической организацией. Об этом после удара украинских дронов по Кремлю заявил спикер Госдумы Володин. По его словам, удар по Кремлю — теракт против президента России. Украина пыталась с помощью двух беспилотных летательных аппаратов нанести удар по резиденции главы государства.
  ",https://lenta.ru/news/2023/05/03/volterr/,"Wed, 03 May 2023 16:50:00 +0300"
"Связь северного сияния и распыления химических препаратов опровергли","
    Косметолог-трихолог Виктория Ощепкова перечислила россиянам способы сохранить качество волос. В первую очередь специалист посоветовала сушить локоны феном на программе с прохладной температурой и с использованием термозащиты. Помимо этого, Ощепкова напомнила о важности употребления необходимых микроэлементов.
  ",https://lenta.ru/news/2023/05/03/hairquality/,"Wed, 03 May 2023 16:48:57 +0300"
"Опубликована карта боевых действий на Украине","
    Сообщение о том, что северное сияние в российских регионах вызвано распылением химических препаратов, оказалось недостоверным. Причина этого природного явления давно известна. Северное сияние возникает в результате взаимодействия солнечного ветра с магнитным полем Земли.
  ",https://lenta.ru/news/2023/05/03/siyanie/,"Wed, 03 May 2023 16:48:43 +0300"
"В ДНР допустили участие американцев в наступлении ВСУ","
    Минобороны России во время ежедневного брифинга показало карту боевых действий на Украине на среду, 3 мая. Видео опубликовано в официальном Telegram-канале военного ведомства. На карте отражены основные события, произошедшие в зоне проведения специальной военной операции.
  ",https://lenta.ru/news/2023/05/03/kartabd3may/,"Wed, 03 May 2023 16:42:58 +0300"
"На куполе дворца в Кремле после атаки беспилотников заметили людей","
    Советник главы ДНР Ян Гагин заявил, что контрнаступлением Вооруженных сил Украины (ВСУ) будут командовать американские инструкторы, поскольку Украина, командиры ВСУ и Владимир Зеленский не имеют политической субъектности. Одним из направлений наступления, по словам Гагина, может стать Артемовск.
  ",https://lenta.ru/news/2023/05/03/gaginvsu/,"Wed, 03 May 2023 16:42:31 +0300"
"Пролет дрона мимо Спасской башни Кремля и взрыв попали на видео","
    На куполе Сенатского дворца в Кремле, вблизи которого была пресечена атака беспилотных летательных аппаратов, заметили группу людей. На кадрах видно, как несколько человек что-то делают около флагштока, еще двое стоят у лестницы, ведущей к центру купола. Уточняется, что обстановка около Красной площади спокойная.
  ",https://lenta.ru/news/2023/05/03/ludi/,"Wed, 03 May 2023 16:41:00 +0300"
"В Астраханской области стартовал казачий конный поход","
    В Москве на видео зафиксировали пролет дрона мимо Спасской башни Кремля. На кадрах аппарат летит со стороны Храма Василия Блаженного. Затем беспилотник взрывается в небе над Сенатским дворцом. Ранее в сеть выложили видео атаки с другого ракурса, на котором хорошо виден подрыв беспилотника. 
  ",https://lenta.ru/news/2023/05/03/prolet305/,"Wed, 03 May 2023 16:39:44 +0300"
"Стали известны подробности атаки беспилотников на Кремль","
    В селе Ушаковка Черноярского района Астраханской области стартовал казачий конный поход, приуроченный к 78-й годовщине победы в Великой Отечественной войне и 80-1 годовщине победы в Сталинградской битве. Поход завершится 5 мая в селе Соленое Займище. Церемония открытия началась с шествия бессмертного полка.
  ",https://lenta.ru/news/2023/05/03/pokhod/,"Wed, 03 May 2023 16:36:00 +0300"
"Россиянку заподозрили в принуждении подростка наблюдать за ее сексом","
    Между атаками двух беспилотных летательных аппаратов (БПЛА) на Кремль прошло 16 минут. Подробности попытки атаки дронов публикует ТВЦ. По информации канала, первый беспилотник заметили в небе над Кремлем в 2:27 по московскому времени. Дрон взорвался над Сенатским дворцом, после чего на крыше произошло возгорание.
  ",https://lenta.ru/news/2023/05/03/bpla/,"Wed, 03 May 2023 16:35:00 +0300"
"Мужчина пошел в аптеку за лекарствами и пережил нападение медведя","
    В Ленинградской области 33-летнюю местную жительницу заподозрили в вовлечении подростка в сексуальные игры. По данным издания, летом 2022 года женщина занималась сексом со своим 26-летним знакомым на глазах у 15-летней школьницы, во время чего пара трогала несовершеннолетнюю за грудь.
  ",https://lenta.ru/news/2023/05/03/igripari/,"Wed, 03 May 2023 16:35:00 +0300"
